SITE_GUBUN,PART_GROUP_ID,PART_SUB_ID,PART_ID,REVIEW_DOC_NO,REVIEW,LABELING,SPLIT_NO
G,P04,S09,154860,RVD-220317-0000006,에센스 양도 많아서 좋았고 촉촉하고 진정되는것 같아 힘들었던 날 해주니 좋더라구요다만 아쉬운건 제 얼굴에 딱 맞는 마스크 모양은 아니였어요전 턱을 지나서 살짝 내려오는 정도가 좋은데 살짝 작은것 같았고눈 구멍은 또 너무 컸어요제가 얼굴이 자란걸까요ㅎㅎ,"[('보습력', '촉촉'), ('효과', '진정')]",2
G,P04,S09,154860,RVD-220317-0000005,일단 마스크팩 자체의 질감이 얼굴에 촤르륵 하고 착 감기는게 아주 좋아요,"[('끈적임', '질감')]",1
G,P04,S09,154860,RVD-220317-0000005,에센스도 듬뿍 있고그런데 필름을 한번 벗기고 얼굴에 붙인다음 겉 필름을 한번 더 벗겨내라 하는데  개인적으로 요게 조금 저는 어렵더라구요,[],2
G,P04,S09,154860,RVD-220317-0000005,그리고 약간 좀 아래로 슬슬 내려가긴 하지만얼굴에 밀착력 하나는 끝내주고 흡수도 비교적 잘 되는 편 이라 20분 정도 지났을땐 거의 다 흡수가 되있는 편이었어요,"[('지속력', '밀착'), ('보습력', '흡수'), ('커버력', '밀착')]",3
G,P04,S09,154860,RVD-220317-0000005,다음날 피부가 확실히 쫀쫀 맨들 맨들 한데 개인적으로 물광 수분감 폭탄 이정도는 아니였던거 같아서 좀 아쉽네요히알루론산이 잘 맞는 피부인데 약간 수분감은 그정도 기대엔 못미쳤지만 전체적으로 마스크 질감이 너무 좋고 에센스도 많지만 헤비하지 않아서 너무 좋았어요,"[('보습력', '수분'), ('끈적임', '질감'), ('효과', '물광')]",4
G,P04,S09,154860,RVD-220317-0000004,평가단으로 제품 받자마자 사용해봤어요일단 에센스가 충분히 많이 들어 있어 몸에도 바를 수 있는 정도구요얼굴에 바르면 촉촉하고 수분이 많아 꽤 오래 갑니다장점이라면 에센스가 정말 풍부해서 흡수되기까지 시간이 좀 걸리는 정도 밤에 자기 전에 하면 딱 좋은 것 같아요,"[('지속력', '오래'), ('보습력', '흡수'), ('보습력', '수분'), ('보습력', '촉촉'), ('거품력', '풍부')]",1
G,P04,S09,154860,RVD-220317-0000004,아침에 하기엔 좀 무겁구요단점이라면 가볍지는 않기 때문에 아침에 사용하긴 좀 어려울 것 같아요제품이 순하고 촉촉해서 전체적으로 만족합니다,"[('보습력', '촉촉')]",2
G,P04,S09,154860,RVD-220317-0000003,생각보다 가벼운 팩 일단 겔 타입 시트형이라 얼굴에 찹하고 붙습니다,[],1
G,P04,S09,154860,RVD-220317-0000003,수분을 가득 머금고 있어서 에센스 자체가 굉장히 수분이 많은데 뒷부분 설명에는 20분 정도 붙여두라고 했지만 그것보다 시트를 빨리 제거하는 게 좋을 것 같아요,"[('보습력', '수분')]",2
G,P04,S09,154860,RVD-220317-0000003,시트 자체가 도로 수분을 다 가져가는 느낌이라 짧게 붙이고 있는 게 좋을 것 같습니다,"[('보습력', '수분')]",3
G,P04,S09,154860,RVD-220317-0000003,생각보다 흡수되고 나면 굉장히 산뜻한 느낌이고 저는 오히려 약간 건조한 느낌도 들었어요 ㅠㅠ,"[('보습력', '흡수'), ('끈적임', '산뜻')]",4
G,P04,S09,154860,RVD-220317-0000003,건성분들은 부족하다고 느낄 수 있을 것 같습니다,[],5
G,P04,S09,154860,RVD-220317-0000003,유분감은 없이 수분감이 낭낭한 제품이라 그런 것 같아요,"[('보습력', '수분'), ('보습력', '유분')]",6
G,P04,S09,154860,RVD-220317-0000003,아 그리고 진정효과는 상당히좋았습니다,"[('효과', '진정'), ('효과', '효과')]",7
G,P04,S09,154860,RVD-220317-0000003,압출한 여드름 부분이 많이 가라앉았어요,"[('효과', '여드름')]",8
G,P04,S09,154860,RVD-220317-0000002,수분감이 너무 좋아요데일리로 이틀에한번 쓰면 피부가 정말로 좋아질 것 같아요촉촉하고 열감도 떨어트려줘서 피부가 편안했어요정말 만족합니다피부가 푸석한날 사용하고 자고 일어났더니 수분이 채워진게 느껴졌어요다음에 재구매 할 것 같아요,"[('보습력', '수분'), ('보습력', '촉촉'), ('기타', '떨어')]",1
G,P04,S09,154860,RVD-220317-0000001,얇아서 밀착력이 좋은 반면 양쪽에 필름을 떼고 사용해야하는데 너무 잘 안떨어져요한쪽은 그나마 보고 떼면 되지만 부착 후에 나머지 한쪽을 안보고 떼야하는데 정말 잘 안떨어져서 힘들었어요,"[('지속력', '밀착'), ('커버력', '밀착'), ('기타', '떨어')]",1
G,P04,S09,154860,RVD-220317-0000001,엄청 얇고 엄청 밀착력 좋아요,"[('지속력', '밀착'), ('커버력', '밀착')]",2
G,P04,S09,154860,RVD-220317-0000001,인중 부분이 빨리 말라 답답함,[],3
G,P04,S09,154860,RVD-220317-0000001,약간 있고 볼 부분은 그래도 촉촉한 편이에요,"[('보습력', '촉촉')]",4
G,P04,S09,154860,RVD-220317-0000001,마르면서 얼굴이 쪼는 느낌이라 오랫동안 팩을 하는건 추천하지 않아요,"[('지속력', '오랫')]",5
G,P04,S09,154860,RVD-220317-0000001,에센스가 눈에 들어가서 많이 아팠어요,[],6
G,P04,S09,154860,RVD-220317-0000001,엄청 묽은 편이라 부착히 주의해야해요,[],7
G,P04,S09,154860,RVD-220317-0000001,피부 건조함 관리하는 데는 좋은 편이에요,[],8
G,P12,S49,122994,RVD-220316-0201199,정말 간편하게 믹스해서 사용할 수 있어서 편한거같아요,"[('기타', '간편'), ('기타', '편하'), ('기타', '편한')]",1
G,P12,S49,122994,RVD-220316-0201199,색도 잘 나오고 좋습니다,[],2
